{
 "$schema": "https://json-schema.org/draft/2020-12/schema",
 "title": "Fertilizantes distribuidos en Italia por región (ISTAT): data/italy-istat/fertilisers.json",
 "type": "object",
 "required": [
  "schemaVersion",
  "generatedAt",
  "source",
  "years",
  "areas",
  "types"
 ],
 "properties": {
  "schemaVersion": {
   "type": [
    "integer",
    "string"
   ]
  },
  "generatedAt": {
   "type": "string",
   "pattern": "^\\d{4}-\\d{2}-\\d{2}T\\d{2}:\\d{2}"
  },
  "source": {
   "type": "object",
   "required": [
    "id",
    "name",
    "url"
   ],
   "properties": {
    "id": {
     "enum": [
      "istat"
     ]
    },
    "name": {
     "type": "string"
    },
    "url": {
     "type": "string"
    }
   }
  },
  "note": {
   "type": "string"
  },
  "years": {
   "type": "array",
   "items": {
    "type": "string"
   }
  },
  "areas": {
   "type": "object",
   "minProperties": 5,
   "additionalSchema": {
    "type": "object",
    "required": [
     "kind",
     "label"
    ],
    "properties": {
     "kind": {
      "enum": [
       "country",
       "macro",
       "zone",
       "region"
      ]
     },
     "label": {
      "type": "object",
      "required": [
       "en",
       "it"
      ],
      "properties": {
       "en": {
        "type": "string"
       },
       "it": {
        "type": "string"
       }
      }
     }
    }
   }
  },
  "unit": {
   "type": "string"
  },
  "types": {
   "type": "object",
   "minProperties": 1,
   "additionalSchema": {
    "type": "object",
    "required": [
     "label",
     "v"
    ],
    "properties": {
     "label": {
      "type": "object",
      "required": [
       "en",
       "it"
      ],
      "properties": {
       "en": {
        "type": "string"
       },
       "it": {
        "type": "string"
       }
      }
     },
     "v": {
      "type": "object",
      "additionalSchema": {
       "type": "array",
       "items": {
        "type": [
         "number",
         "null"
        ]
       }
      }
     }
    }
   }
  }
 }
}
