{"schemaVersion":1,"generatedAt":"2026-10-15T20:20:57Z","source":{"id":"istat","name":"ISTAT","url":"https://esploradati.istat.it/databrowser/"},"years":["2013","2014","2015","2016","2017","2018","2019","2020","2021","2022","2023","2024"],"areas":{"IT":{"kind":"country","label":{"en":"Italy","it":"Italia"}},"ITC1":{"kind":"region","label":{"en":"Piemonte","it":"Piemonte"}},"ITC2":{"kind":"region","label":{"en":"Valle d'Aosta / Vallée d'Aoste","it":"Valle d'Aosta / Vallée d'Aoste"}},"ITC3":{"kind":"region","label":{"en":"Liguria","it":"Liguria"}},"ITC4":{"kind":"region","label":{"en":"Lombardia","it":"Lombardia"}},"ITCD":{"kind":"macro","label":{"en":"Nord","it":"Nord"}},"ITD1":{"kind":"region","label":{"en":"Provincia Autonoma Bolzano / Bozen","it":"Provincia Autonoma Bolzano / Bozen"}},"ITD2":{"kind":"region","label":{"en":"Provincia Autonoma Trento","it":"Provincia Autonoma Trento"}},"ITD3":{"kind":"region","label":{"en":"Veneto","it":"Veneto"}},"ITD4":{"kind":"region","label":{"en":"Friuli-Venezia Giulia","it":"Friuli-Venezia Giulia"}},"ITD5":{"kind":"region","label":{"en":"Emilia-Romagna","it":"Emilia-Romagna"}},"ITDA":{"kind":"region","label":{"en":"Trentino Alto Adige / Südtirol","it":"Trentino Alto Adige / Südtirol"}},"ITE":{"kind":"zone","label":{"en":"Centro (I)","it":"Centro"}},"ITE1":{"kind":"region","label":{"en":"Toscana","it":"Toscana"}},"ITE2":{"kind":"region","label":{"en":"Umbria","it":"Umbria"}},"ITE3":{"kind":"region","label":{"en":"Marche","it":"Marche"}},"ITE4":{"kind":"region","label":{"en":"Lazio","it":"Lazio"}},"ITF1":{"kind":"region","label":{"en":"Abruzzo","it":"Abruzzo"}},"ITF2":{"kind":"region","label":{"en":"Molise","it":"Molise"}},"ITF3":{"kind":"region","label":{"en":"Campania","it":"Campania"}},"ITF4":{"kind":"region","label":{"en":"Puglia","it":"Puglia"}},"ITF5":{"kind":"region","label":{"en":"Basilicata","it":"Basilicata"}},"ITF6":{"kind":"region","label":{"en":"Calabria","it":"Calabria"}},"ITFG":{"kind":"macro","label":{"en":"Mezzogiorno","it":"Mezzogiorno"}},"ITG1":{"kind":"region","label":{"en":"Sicilia","it":"Sicilia"}},"ITG2":{"kind":"region","label":{"en":"Sardegna","it":"Sardegna"}}},"types":{"ALL":{"label":{"en":"all items","it":"tutte le voci"},"v":{"IT":[4114933.0,4228949.0,4047366.0,4578506.0,4713425.0,4572288.0,4341800.0,4930148.0,4761799.0,3496501.0,4540601.0,4058981.0],"ITC1":[376483.4,402506.0,396383.0,418039.0,393506.0,373401.0,377038.0,406416.0,424785.0,348462.0,405348.0,331443.0],"ITC2":[3180.9,3153.0,544.0,394.0,382.0,661.0,1262.0,884.0,349.0,571.0,188.0,164.0],"ITC3":[57813.2,46564.0,43564.0,63525.0,50869.0,50970.0,31273.0,41112.0,39684.0,34195.0,33105.0,18115.0],"ITC4":[744504.5,794375.0,683460.0,912262.0,885314.0,939322.0,928504.0,1168049.0,1075240.0,754413.0,809139.0,810622.0],"ITCD":[2705842.5,2804689.0,2591501.0,3018677.0,3095360.0,3111273.0,2932898.0,3346332.0,3244814.0,2368462.0,2613230.0,2347500.0],"ITD1":[18991.8,26662.0,29853.0,24952.0,17402.0,18051.0,23298.0,20782.0,20829.0,20280.0,15514.0,19007.0],"ITD2":[22389.6,24398.0,23516.0,22869.0,22861.0,24354.0,21112.0,18043.0,16687.0,17868.0,11273.0,14585.0],"ITD3":[653970.5,692534.0,678333.0,711102.0,737802.0,733390.0,640193.0,678176.0,713500.0,415287.0,465322.0,367388.0],"ITD4":[151673.3,133201.0,135156.0,120088.0,126390.0,122863.0,103805.0,144739.0,109179.0,76485.0,105616.0,80731.0],"ITD5":[676835.3,681296.0,600692.0,745448.0,860834.0,848261.0,806413.0,868131.0,844561.0,700899.0,767725.0,705446.0],"ITDA":[41381.4,51060.0,53369.0,47821.0,40263.0,42405.0,44410.0,38825.0,37515.0,38148.0,26786.0,33593.0],"ITE":[664695.5,647387.0,638284.0,610655.0,707568.0,618832.0,575019.0,614630.0,626757.0,458147.0,676586.0,570228.0],"ITE1":[246026.0,220382.0,231244.0,256649.0,273013.0,237583.0,222041.0,214568.0,210254.0,197319.0,365918.0,313434.0],"ITE2":[71602.4,81400.0,76610.0,81056.0,85452.0,69856.0,63330.0,62914.0,64764.0,38196.0,34383.0,36180.0],"ITE3":[106251.1,118257.0,123560.0,115651.0,123399.0,108594.0,105240.0,136060.0,119961.0,76409.0,91972.0,80779.0],"ITE4":[240816.0,227348.0,206870.0,199592.0,225704.0,202799.0,184408.0,201088.0,231777.0,146222.0,184313.0,139834.0],"ITF1":[50779.6,58005.0,57099.0,84981.0,74108.0,70356.0,75323.0,89732.0,82587.0,61172.0,76576.0,66600.0],"ITF2":[13000.8,23920.0,24927.0,19059.0,12899.0,13862.0,15517.0,19241.0,10032.0,6505.0,8667.0,9230.0],"ITF3":[116959.7,116453.0,124719.0,141309.0,133129.0,123648.0,118641.0,206707.0,146095.0,99874.0,165200.0,157867.0],"ITF4":[261371.2,264434.0,255255.0,296602.0,326996.0,258094.0,238141.0,267497.0,287677.0,216984.0,400931.0,357838.0],"ITF5":[13210.5,15216.0,21378.0,19967.0,22985.0,19155.0,17985.0,25176.0,36598.0,25538.0,37457.0,38421.0],"ITF6":[75543.9,78037.0,69445.0,75717.0,83873.0,84940.0,77794.0,79240.0,83729.0,52680.0,171097.0,159118.0],"ITFG":[744395.0,776873.0,817581.0,823945.0,910497.0,842183.0,833883.0,969186.0,890229.0,669892.0,1250785.0,1141253.0],"ITG1":[158149.6,151044.0,193501.0,187668.0,202906.0,212110.0,218847.0,190140.0,188549.0,158193.0,325371.0,295171.0],"ITG2":[55379.7,69764.0,71257.0,81575.0,53601.0,60018.0,71635.0,91453.0,54964.0,48945.0,65487.0,57008.0]}},"AMMENDANTI":{"label":{"en":"amendment","it":"ammendanti"},"v":{"IT":[1257184.0,1255764.0,1172281.0,1222503.0,1175259.0,1255700.0,1320570.0,1293488.0,1209906.0,1241302.0,1281918.0,1026213.0],"ITC1":[119935.3,119832.0,112913.0,145794.0,122845.0,135641.0,146310.0,127421.0,114928.0,147199.0,179779.0,121726.0],"ITC2":[3057.6,2988.0,275.0,61.0,74.0,342.0,207.0,215.0,130.0,415.0,39.0,48.0],"ITC3":[47673.8,32873.0,29973.0,19158.0,21022.0,23872.0,18436.0,18955.0,21703.0,20620.0,19064.0,5475.0],"ITC4":[339261.9,316750.0,251525.0,307852.0,316470.0,388936.0,374290.0,380151.0,361042.0,351766.0,378805.0,411353.0],"ITCD":[922353.9,917131.0,860142.0,927527.0,863017.0,975575.0,959846.0,960630.0,932465.0,901569.0,882927.0,768463.0],"ITD1":[4724.8,5341.0,12280.0,1713.0,1872.0,2198.0,10597.0,4298.0,1069.0,10436.0,2631.0,6490.0],"ITD2":[11486.0,11761.0,9106.0,7943.0,5943.0,7960.0,9676.0,5518.0,5125.0,7558.0,3835.0,9108.0],"ITD3":[233334.1,279553.0,287258.0,295146.0,257137.0,289257.0,223080.0,211129.0,272671.0,154774.0,137586.0,116986.0],"ITD4":[39530.6,34014.0,31442.0,15216.0,22637.0,18533.0,17144.0,28127.0,9453.0,7947.0,19603.0,9080.0],"ITD5":[123349.8,114019.0,125370.0,134644.0,115017.0,108836.0,160106.0,184816.0,146344.0,200854.0,141585.0,88197.0],"ITDA":[16210.8,17102.0,21386.0,9656.0,7815.0,10158.0,20273.0,9816.0,6194.0,17994.0,6466.0,15598.0],"ITE":[188156.0,184721.0,162751.0,143325.0,178235.0,151825.0,143452.0,133019.0,145920.0,170939.0,134794.0,45026.0],"ITE1":[58386.5,51309.0,51909.0,44798.0,65012.0,56247.0,52788.0,50609.0,44410.0,79420.0,51703.0,13639.0],"ITE2":[13452.9,17043.0,14506.0,14359.0,25154.0,9971.0,5623.0,3663.0,4524.0,8393.0,4570.0,1135.0],"ITE3":[15245.0,22465.0,19188.0,20818.0,20888.0,16780.0,16420.0,20669.0,16529.0,18180.0,15010.0,4769.0],"ITE4":[101071.6,93904.0,77148.0,63350.0,67181.0,68827.0,68621.0,58078.0,80457.0,64946.0,63511.0,25483.0],"ITF1":[7176.9,12374.0,12968.0,15743.0,14207.0,18890.0,20976.0,23920.0,22641.0,33480.0,30903.0,23757.0],"ITF2":[613.2,735.0,732.0,221.0,195.0,173.0,241.0,904.0,442.0,282.0,239.0,370.0],"ITF3":[16178.8,18772.0,15119.0,20517.0,16788.0,16498.0,17287.0,17144.0,15187.0,19435.0,20274.0,12010.0],"ITF4":[49645.1,51265.0,40425.0,40461.0,47316.0,33959.0,53398.0,34109.0,24594.0,28111.0,42967.0,34549.0],"ITF5":[1698.3,1984.0,6434.0,4735.0,7731.0,4295.0,4302.0,4979.0,1973.0,1696.0,1150.0,2290.0],"ITF6":[13385.2,12662.0,12755.0,11589.0,10100.0,11035.0,14782.0,11482.0,14739.0,14689.0,40763.0,28917.0],"ITFG":[146674.1,153912.0,149388.0,151651.0,134007.0,128300.0,217272.0,199839.0,131521.0,168794.0,264197.0,212724.0],"ITG1":[47917.6,45646.0,48581.0,29342.0,33127.0,33929.0,71978.0,73623.0,41370.0,41079.0,98189.0,87274.0],"ITG2":[10059.0,10474.0,12374.0,29043.0,4543.0,9521.0,34308.0,33678.0,10575.0,30022.0,29712.0,23557.0]}},"AMMENDANTI_ALTRI":{"label":{"en":"other soil amendments","it":"ammendanti  - altri ammendanti non vegetali, torbosi, misti o a base di torba o letame"},"v":{"IT":[43199.5,46699.0,65539.0,64220.0,106710.0,86647.0,81447.0,76968.0,166933.0,127779.0,139893.0,143362.0],"ITC1":[1535.9,1119.0,3221.0,18516.0,3987.0,3036.0,2895.0,4980.0,5047.0,4897.0,6645.0,12154.0],"ITC2":[2.1,1.0,8.0,0.0,3.0,3.0,2.0,4.0,1.0,3.0,3.0,4.0],"ITC3":[12666.0,12666.0,12736.0,178.0,171.0,157.0,146.0,234.0,270.0,236.0,22.0,35.0],"ITC4":[19107.2,514.0,1737.0,971.0,120.0,1242.0,1760.0,108.0,3456.0,6624.0,35122.0,60754.0],"ITCD":[36202.3,39803.0,45598.0,48423.0,81224.0,69864.0,64467.0,54696.0,144707.0,86588.0,69449.0,81370.0],"ITD1":[57.4,66.0,83.0,62.0,57.0,1.0,43.0,42.0,3.0,657.0,9.0,53.0],"ITD2":[131.3,114.0,155.0,193.0,138.0,27.0,140.0,17.0,25.0,20.0,140.0,30.0],"ITD3":[846.3,18607.0,19346.0,19707.0,72771.0,60685.0,51469.0,32946.0,103025.0,30621.0,12763.0,4014.0],"ITD4":[909.1,4794.0,5267.0,18.0,19.0,15.0,15.0,14.0,9.0,43.0,42.0,11.0],"ITD5":[947.0,1922.0,3045.0,8778.0,3958.0,4698.0,7997.0,16351.0,32871.0,43487.0,14703.0,4315.0],"ITDA":[188.7,180.0,238.0,255.0,195.0,28.0,183.0,59.0,28.0,677.0,149.0,83.0],"ITE":[4243.2,5255.0,15151.0,6890.0,15513.0,1863.0,10096.0,13140.0,18514.0,27008.0,28970.0,3241.0],"ITE1":[1908.1,431.0,5678.0,499.0,5032.0,1467.0,1637.0,5467.0,12808.0,18728.0,21035.0,939.0],"ITE2":[109.0,6.0,199.0,10.0,2.0,10.0,6.0,7.0,515.0,6.0,8.0,4.0],"ITE3":[152.9,116.0,977.0,33.0,43.0,13.0,17.0,769.0,24.0,20.0,9.0,21.0],"ITE4":[2073.2,4702.0,8297.0,6348.0,10436.0,373.0,8436.0,6897.0,5167.0,8254.0,7918.0,2277.0],"ITF1":[73.0,50.0,907.0,49.0,820.0,5851.0,63.0,4201.0,70.0,8064.0,13035.0,5216.0],"ITF2":[5.5,0.0,136.0,0.0,2.0,0.0,3.0,0.0,54.0,1.0,53.0,200.0],"ITF3":[131.9,48.0,1235.0,485.0,123.0,292.0,39.0,51.0,68.0,54.0,61.0,14.0],"ITF4":[530.9,372.0,985.0,1796.0,2543.0,3230.0,106.0,91.0,106.0,178.0,22721.0,22153.0],"ITF5":[173.4,9.0,107.0,106.0,1.0,28.0,3.0,13.0,10.0,17.0,1.0,0.0],"ITF6":[467.5,98.0,157.0,6213.0,4349.0,3721.0,3067.0,5.0,2.0,127.0,231.0